Serie ID;#Season;#Episode;Episode title;Length (minutes);Synopsis
80020542;1;1;Piloto;49;El nuevo detective James Gordon y su veterano compañero Harvey Bullock investigan el asesinato de una pareja de multimillonarios, padres de Bruce Wayne, de 12 años.
80020542;1;2;Selina Kyle;43;Gordon y Bullock investigan una red de tráfico infantil que asedia a niños callejeros, incluida Selina. El Pingüino comienza su regreso a Gotham.
80020542;1;3;El Hombre de los globos;43;Gordon y Bullock siguen la pista a un justiciero que persigue a los habitantes corruptos de Gotham, a los que ata a globos meteorológicos para matarlos.
80020542;1;4;Arkham;43;Se acerca el polémico referéndum municipal sobre el futuro del distrito de Arkham y los políticos de ambos bandos están en peligro.
80020542;1;5;Víbora;43;Gordon y Bullock buscan el origen de una nueva droga que provoca una euforia letal. Cobblepot sigue acercándose al círculo más íntimo de Maroni.
80020542;1;6;El Espíritu de la cabra;43;El primogénito de la élite de Gotham se convierte en el objetivo de un asesino y Bullock debe hacer frente a los traumáticos recuerdos de un antiguo caso muy similar.
80020542;1;7;El paraguas del Pingüino;43;El Pingüino añade un nuevo elemento a su estrategia de manipulación y obliga a Gordon a afrontar las consecuencias de su decisión de perdonarle la vida.
80020542;1;8;La máscara;43;Gordon y Bullock están intrigados por el motivo de la muerte a golpes de un habitante de Gotham. Bruce vuelve al colegio, pero le cuesta hacer amigos.
80020542;1;9;Harvey Dent;43;Harvey Dent anima a Gordon a que se alíe con el alcalde James para intentar cerrar el caso de los Wayne. El Pingüino contacta con Liza, el arma secreta de Mooney.
80020542;1;10;Lovecraft;43;Selina y un nuevo amigo inician una arriesgada huida por Gotham para escapar de los asesinos que la persiguen. Un tropiezo provoca el traslado de Gordon.
80020542;1;11;La galería de los granujas;43;La investigación, avivada por el asesinato de un guardia, complica la misión de Gordon en el manicomio Arkham y lo lleva a la Dra. Leslie Thompkins.
80020542;1;12;Lo que le dijo un pajarito;43;Para intentar recuperar su trabajo, Gordon quiere capturar a Jack Gruber, un genio electricista trastornado que se escapa del manicomio de Arkham.
80020542;1;13;Bienvenido de nuevo, Jim Gordon;43;El testigo clave de un asesinato, retenido para ser interrogado, aparece muerto. Gordon sospecha de alguien interno y acude a un viejo amigo para conseguir más datos.
80020542;1;14;El aterrador Dr. Crane;43;Fish revela un secreto de Cobblepot que lleva a Maroni a poner a prueba su lealtad. Gordon y Bullock buscan a un asesino que aprovecha las fobias de sus víctimas.
80020542;1;15;El Espantapájaros;43;Gordon y Bullock intentan detener a un profesor de Biología que extrae las glándulas a sus víctimas. Mooney sigue conspirando para conseguir más poder.
80020542;1;16;El adivino ciego;43;La velada de Gordon y la doctora Leslie Thompkins en el circo termina con un incidente. Falcone contrata a Butch Gilzean para que ayude al Pingüino con el pub.
80020542;1;17;La capucha roja;43;Después de los atracos a varios bancos, Gordon y Bullock investigan a la banda de Capucha Roja. Selina Kyle está cada vez más unida a Bárbara.
80020542;1;18;Todo el mundo tiene un Cobblepot;43;Gordon busca información sobre la reciente polémica con el comisario Loeb, mientras la alianza de Fish con los presos se pone en entredicho.
80020542;1;19;Depredadores;42;Gordon y Bullock investigan el caso pendiente de un asesino en serie obsesionado con las chicas jóvenes de Gotham. Fish planea su huida del fabricante de muñecas.
80020542;1;20;Operado;43;Gordon y Bullock siguen investigando al Ogro, que ronda a alguien cercano a Gordon. Bruce y Selina destapan la corrupción de la compañía de la familia Wayne.
80020542;1;21;El yunque o el martillo;43;El Ogro manipula a Bárbara mientras Gordon y Bullock hacen lo imposible por encontrarle. La masacre liderada por el Pingüino marca el inicio de una épica contienda.
80020542;1;22;Todas las familias felices son iguales;43;Mientras la guerra entre las bandas de Gotham alcanza su punto más álgido, Fish Mooney se enfrenta a Maroni y el Pingüino para recuperar la ciudad.
80020542;2;1;Siempre va a acabar mal;43;Bruce continúa descubriendo secretos sobre su padre. Gordon se alía —a regañadientes— con Oswald Cobblepot.
80020542;2;2;Toc, toc;43;Gordon se hace cargo de la búsqueda de los evadidos del manicomio Arkham. Mientras tanto, Alfred toma medidas drásticas para proteger a Bruce.
80020542;2;3;La última risa;43;Alfred convence a Bruce de que asista a un acto benéfico en un hospital infantil, que tendrá un final muy siniestro.
80020542;2;4;Fuerza de asalto;43;Tras una tragedia en el departamento, ascienden a Gordon y se renuevan las fuerzas para luchar contra el mal. Theo Galavan traza un plan para el futuro de Gotham.
80020542;2;5;Escarificación;42;Una ola de crímenes azota Gotham cuando el Pingüino y Galavan se alían con una familia de pirómanos. Resurgen las viejas rencillas entre los Galavan y los Wayne.
80020542;2;6;A fuego;43;Una indecisa Bridgit sopesa sus opciones. El Pingüino y Galavan siguen batallando para conseguir el poder.
80020542;2;7;El monstruito de mamá;43;El Pingüino busca venganza y está decidido a liberar a su madre. Tras encontrarse por primera vez, Silver y Selina se enfrentan a cuenta de Bruce.
80020542;2;8;Esta es la noche;43;Bárbara se despierta de una pesadilla horrible. Galavan, movido por sus ansias de poder, le hace una oferta a Bruce difícil de rechazar.
80020542;2;9;Una píldora difícil de tragar;43;Lee se preocupa por el lado oscuro de Gordon. Edward cuida a un herido Pingüino y le pide consejo.
80020542;2;10;El hijo de Gotham;43;Selina y Bruce renuevan su alianza. Gordon sigue decidido a poner a Galavan entre rejas, que es donde debe estar.
80020542;2;11;Peor que un enemigo;42;Tras el secuestro de Bruce, Gordon recurre a un inesperado aliado para detener los planes de venganza de Galavan contra los Wayne.
80020542;2;12;Mr. Freeze;42;Gordon se prepara para un testimonio importante. Ha llegado a Gotham un villano escalofriante, que mata de frío a la gente.
80020542;2;13;Un hombre muerto no siente frío;42;Alfred tiene novedades sobre el hombre que asesinó a los padres de Bruce. La policía se prepara para trasladar a un nuevo interno al manicomio Arkham.
80020542;2;14;Esta bola de barro y maldad;43;"El Pingüino continúa su trabajo con Hugo Strange, que está convencido de que le puede ""curar"" la agresividad. Bruce se jura encontrar al asesino de sus padres."
80020542;2;15;Loco amanecer gris;43;Mientras Gordon y Bullock investigan un robo en un museo, el Pingüino visita a unos viejos amigos, y Bruce comprueba si es capaz de desenvolverse en las calles.
80020542;2;16;Prisioneros;43;Gordon intenta sobrevivir en la cárcel. Bullock entrega unas noticias terribles. El Pingüino lidia con su familia desestructurada.
80020542;2;17;Dentro del bosque;43;Un desesperado Gordon lucha por lavar su imagen. El Pingüino descubre la sorprendente verdad sobre la muerte de su padre.
80020542;2;18;Pinewood;41;Bárbara quiere hacer las paces con Gordon. Bruce y Alfred emprenden la búsqueda de un antiguo socio de Thomas Wayne.
80020542;2;19;Azrael;43;Gordon interroga al profesor Strange sobre su trabajo en Pinewood Farms. Un nuevo y peligroso villano se prepara para tomar el control de la ciudad.
80020542;2;20;Liberado;42;Las intenciones de Azrael de acabar con Jim Gordon hacen que el Pingüino vuelva a aparecer. Bruce no tardará en convertirse en el nuevo objetivo.
80020542;2;21;Legión de villanos;41;Con la ayuda de Gordon, Lucius y Alfred, Bruce intenta rescatar a Selina. Pero primero tendrán que encontrar el laboratorio secreto del profesor Strange.
80020542;2;22;Transferencia;42;Gordon se somete a una profunda transformación en el laboratorio del profesor Strange. Una nueva amenaza se cierne sobre Gotham.
80020542;3;1;Mejor reinar en el infierno;44;Gordon sale a las calles de Gotham para dar caza a Hugo Strange, un supervillano científico y loco, y a Fish Mooney, a la que ha reanimado.
80020542;3;2;Quemad a la bruja;44;Mientras Fish está decidida a encontrar al profesor Strange, que aún anda suelto, Gordon y la periodista Valerie Vale intentan localizarla.
80020542;3;3;Mírame a los ojos;44;Gordon decide ayudar a Jervis Tetch, recién llegado a Gotham, a encontrar a su hermana. Entretanto, el Pingüino se presenta como candidato a alcalde.
80020542;3;4;Un nuevo día;44;El Pingüino está obsesionado con llegar a ser alcalde de Gotham, y Bruce y Alfred peinan la ciudad en busca del doble de Bruce, que le ha usurpado su identidad.
80020542;3;5;Cualquier cosa por ti;43;Mientras Bruce busca a Ivy, el recién elegido alcalde Cobblepot tiene que hacer frente a un montón de promesas electorales y a un nivel de delincuencia sin precedentes.
80020542;3;6;Seguid al conejo blanco;42;"El sádico Sombrerero Loco obliga a Gordon a tomar una angustiosa decisión. Edward ""Ed"" Nygma, amante de los acertijos, se reencuentra con alguien del pasado."
80020542;3;7;La reina roja;44;Tras discutir con el Sombrerero Loco, Gordon entra en una espiral de psicodelia. El Pingüino intenta aceptar la naturaleza de la nueva relación de Nygma.
80020542;3;8;Fiebre en la sangre;44;Mientras Barnes enloquece, Nygma sortea su relación con Isabella. Falcone organiza una fiesta de compromiso para Lee y Mario.
80020542;3;9;El verdugo;43;Gordon le pide a Bullock que investigue a Barnes, y Nygma acude al Pingüino cuando recibe malas noticias. Ivy se sincera con Bruce y Selina.
80020542;3;10;Bomba de tiempo;44;Mientras surge una nueva amenaza antes de la cena de ensayo de Lee y Mario, Bruce empieza a desentrañar los secretos que rodean a la Corte de los Búhos.
80020542;3;11;Cuidado con el monstruo de ojos verdes;44;A medida que el virus empieza a propagarse por la ciudad, el laboratorio que desarrolla la cura corre peligro. Gordon y Mario se enfrentan antes de la boda.
80020542;3;12;Fantasmas;42;Gordon y Bullock descubren planes siniestros para revivir a un viejo enemigo. La madre de Selina regresa a Gotham, y el Pingüino se prepara para la entrevista de TV.
80020542;3;13;Sonríe como si quisieras;42;Le decisión de Dwight de revivir a Jerome desata la histeria entre sus seguidores. La lucha de poder entre el Pingüino y Nygma se intensifica.
80020542;3;14;El gentil arte de hacer enemigos;44;Bruce se convierte en el próximo objetivo de Jerome. En otro lugar, el tío de Gordon llega de visita, y el Pingüino y Nygma se enfrentan a sus problemas.
80020542;3;15;Cómo Riddler consiguió su nombre;43;"Gotham se enfrenta a un nuevo villano con la aparición de Nygma como ""el Enigma"". Nuevos y perturbadores detalles sobre la muerte del padre de Gordon salen a la luz."
80020542;3;16;Estas delicadas y oscuras obsesiones;43;Una terrible arma amenaza la ciudad y Bruce empieza sus clases con el Chamán. Mientras tanto, Gordon descubre vínculos desconcertantes en su árbol genealógico.
80020542;3;17;El enigma primordial;43;La ciudad de Gotham presiente el peligro cuando algunos de sus villanos más famosos se reúnen para hablar.
80020542;3;18;Encender la mecha;44;Una serie de verdades atroces salen a la palestra y Gordon presiona a Kathryn por un lugar en la Corte de los Búhos. Mientras tanto, Bruce intensifica su entrenamiento.
80020542;3;19;Todos serán juzgados;44;A la vez que el Chamán da a conocer sus intenciones, un descubrimiento increíble libera los secretos del inframundo de Gotham. El Pingüino y el Enigma deben trabajar juntos.
80020542;3;20;Bonita máquina de odio;44;Un virus mortal se cierne sobre Gotham y algunos de los villanos más retorcidos de la ciudad unen fuerzas. Mientras tanto, el joven Bruce comienza a aceptar su destino.
80020542;3;21;La llamada del destino;43;La búsqueda de un antídoto se intensifica a medida que la oscuridad se propaga por Gotham y un trío de villanos trama sus planes. Bruce no logra dejar atrás el pasado.
80020542;3;22;Alma pesada y sucia;44;Gotham está acordonada y Lee busca la manera de salir de la ciudad. Gordon le hace una propuesta a Nygma, y Bruce acude al lado de Alfred.
80020542;4;1;Pax penguina;43;Mientras Bruce se adapta a la vida de justiciero, el Pingüino planea la gran inauguración de su nuevo local y un nuevo villano obliga a Gotham a afrontar sus miedos.
80020542;4;2;El atemorizador;44;A medida que el Espantapájaros reúne un ejército, el Pingüino desafía públicamente a Gordon a dar con Jonathan Crane. Selina y Tabitha negocian una nueva alianza.
80020542;4;3;Los que se esconden tras máscaras;44;Gordon acude a Falcone en busca de ayuda y Bruce recurre al uso de disfraces. Un robo en el local del Pingüino supone todo un golpe para él.
80020542;4;4;La cabeza del demonio;44;Bruce y Alfred se la juegan mientras investigan los orígenes del ancestral cuchillo. Por su parte, Nygma busca venganza... pero parece haber perdido su toque especial.
80020542;4;5;La senda del cuchillo;44;Bruce decide hacer las cosas por su cuenta y riesgo, y Nygma se enfrenta a un antiguo socio. Sofia apela al lado más sensible del Pingüino.
80020542;4;6;La tarde del día del cerdo;44;"Un nuevo asesino ha llegado a Gotham: un perturbado que mata policías y los ""decora"" con cabezas de cerdo cercenadas. Grundy se sube al ring."
80020542;4;7;Un día en los Narrows;44;El Pingüino ofrece su ayuda tras la entrega de perturbador paquete en la comisaría. Una antigua amiga de Bruce lo convence para salir con otros compañeros de clase.
80020542;4;8;Deja de darte;44;El Pingüino envía a las Sirenas a por Nygma tras enterarse de que este se está burlando de él. Un ascenso provoca tensiones entre Gordon y Bullock.
80020542;4;9;Déjalos que coman pastel;44;Cuando Sofia planea una recaudación de fondos de alto copete para el orfanato, el Profesor Pyg demuestra de lo que es capaz. Bruce y Alfred tienen una discusión.
80020542;4;10;Cosas que explosionan;44;Gordon escarba en el pasado de Pyg para intentar desenmascararlo mientras Lee reafirma su control sobre los Narrows y el Pingüino arremete contra Sofia.
80020542;4;11;Reina mata a caballo;44;El plan del Pingüino para atraer a Gotham a un viejo rival provoca una inesperada escalada de violencia. Alfred y Bruce discuten a cuenta del mal comportamiento de este.
80020542;4;12;Piezas de un espejo roto;44;Un nuevo y peculiar personaje echa raíces en Gotham, Alfred se adapta a la vida fuera de la mansión Wayne y Nygma apoya a Lee en su cruzada por reconstruir los Narrows.
80020542;4;13;Una hermosa oscuridad;44;Ivy deja tras de sí perfumadas tarjetas de visita mientras busca información sobre un proyecto secreto, Jerome se burla del Pingüino y Bruce ve su futuro en sueños.
80020542;4;14;Re-uniones;44;Sofia plantea sus exigencias sobre los Narrows, y un arrepentido Bruce va en busca de Alfred y su perdón. Un ataque que parece un acto de venganza sacude toda Gotham.
80020542;4;15;El barco se hunde, un gran aplauso;44;Gordon y Bullock buscan a un testigo clave para acabar con Sofia, Lee les propone al Pingüino y Nygma un plan para vengarse, y Selina le pide ayuda a Bruce.
80020542;4;16;Una de mis tres sopas;44;Una fuga masiva de Arkham desencadena el caos y hace correr la sangre en las calles. Bruce persigue a un viejo enemigo y Barbara lidia con dolorosos recuerdos.
80020542;4;17;Almuerzo obligatorio;44;"Jerome convoca la primera reunión de la ""Legión de Horribles"" y Nygma presenta un espectáculo en los Narrows. El Pingüino acude a Butch con una propuesta."
80020542;4;18;Esto es entretenimiento;44;Cuando Jerome plantea sus exigencias para Gotham, Gordon le propone un plan a Bruce. El Pingüino no las tiene todas consigo, y Barbara descubre su destino.
80020542;4;19;Hasta nuestras muertes y más allá;44;Una oleada de atracos mantiene ocupados a Gordon y Bullock. Una malvada presencia despierta de nuevo poniendo a Barbara en peligro y obligando a Selina a elegir bando.
80020542;4;20;Ese viejo cadáver;44;Es el caos. Los seguidores de Jerome asaltan la comisaría y Nygma planea la liberación de Lee. Bruce va teniendo más confianza en Jeremiah.
80020542;4;21;Un mal día;44;Bullock trata de detener un plan explosivo con ayuda de los héroes más improbables de la ciudad. Bruce atiende una llamada que remueve sus miedos más profundos.
80020542;4;22;Tierra de nadie;44;La oscura premonición de Ra's al Ghul se ha cumplido: el gobernador declara la ley marcial y Jeremiah conduce a Bruce a una trampa. Pero Barbara está lista para luchar.
70143844;1;1;Piloto;58;Jax está cada vez más harto de la creciente anarquía que impera en el club de motoristas al que pertenece, y su exmujer, una drogadicta, da a luz a su hijo.
70143844;1;2;Semillas;47;Un nuevo adjunto al jefe de policía llega a Charming, y Jax propone una forma no violenta de conseguir que pierda el rastro del club.
70143844;1;3;La feria;48;Los Hijos empuñan las armas para capturar a un agresor después de que la hija de una importante familia resulte asaltada. Entretanto, el ex de Tara le hace una visita.
70143844;1;4;La absorción;44;Los miembros del club ponen rumbo a Nevada para prestar ayuda a un club hermano, la Tribu del Diablo, que ha recibido amenazas de los Mayas.
70143844;1;5;La venganza;42;Un exmiembro del club, responsable del arresto de Opie, genera tensiones durante un acto benéfico. Mientras, la investigación del club sigue su curso.
70143844;1;6;Armas mortales;43;Cuando un camarada de guerra de Piney solicita un favor, será Jax quien tenga que ocuparse de todo. Además, alguien del pasado se pasa de visita.
70143844;1;7;Huesos del pasado;44;Cuando descubren unos huesos a las afueras de Charming, los secretos que Clay enterró reemergen. Además, la investigación de Kohn se vuelve personal.
70143844;1;8;Atracción;44;Se acerca el momento de pagar por las armas al Ejército Republicano Irlandés, y el club hace lo imposible por conseguir el dinero.
70143844;1;9;Y llegó el infierno;45;Los Hijos atienden a Cameron Hayes, gravemente herido, al tiempo que planean una revancha contra un grupo de moteros rival.
70143844;1;10;El lado bueno;44;Stahl presiona a las mujeres del club, y Jax ve en Unser la clave para salvar al grupo. Entretanto, Cherry revela información sobre su pasado.
70143844;1;11;Capibara;43;Jax debe elegir entre la amistad y su lealtad para con el club cuando un miembro es arrestado por asesinato y otro desaparece.
70143844;1;12;El sueño de los bebés;48;La solución que plantea Clay para pagar la defensa de Bobby deja al club en una posición vulnerable, y la feliz vuelta a casa de Abel acaba en conflicto.
70143844;1;13;El revelador;62;A raíz de una tragedia, el club deberá reevaluar sus lazos de hermandad.
70143844;2;1;Poder blanco;49;Tras la muerte de Donna, el club se encuentra dividido, y Clay aprovecha para acordar un nuevo trato de provisión de armas con el Ejército Republicano Irlandés.
70143844;2;2;Pequeños desgarros;44;La decisión tomada por Jax sin contar con la aprobación del club no le sienta nada bien a Clay, máxime cuando esta acarrea peligrosas repercusiones.
70143844;2;3;El apaño;43;La Liga da nuevos y audaces pasos en su cruzada por sabotear al club, cuyos miembros se ven obligados a tomar medidas... explosivas.
70143844;2;4;Eureka;43;"El club se mete en problemas cuando ponen rumbo norte en una carrera ""benéfica"". Mientras, en Charming, Gemma se ve en una comprometida situación con la Liga."
70143844;2;5;Golpe mortal;45;Charming y su pintoresco atractivo se convierten en objetivos de la Liga, quienes encuentran nuevas formas de provocar a los Hijos.
70143844;2;6;El cerebro;43;Zobelle incita a Clay a que tome represalias, lo que obliga a Jax a recurrir a una inusitada fuente para evitar la destrucción del club.
70143844;2;7;Gilead;46;La Liga tiene algunos miembros entre rejas, así que el club deberá forjar nuevas alianzas en la cárcel para sobrevivir.
70143844;2;8;La cena;39;El suministro de armas escasea, y el club recurre a medidas extremas para cumplir con el pedido de un cliente.
70143844;2;9;Negocios legales;43;El negocio de las películas para adultos se está convirtiendo en una carga, y Clay aprovecha la ocasión para resucitar el cártel de tráfico de armas.
70143844;2;10;Bálsamo;57;El nuevo negocio demuestra ser más fructífero de lo que el club hubiera pensado, y la agente Stahl toma nota de los jugosos beneficios.
70143844;2;11;A su servicio;48;Chibs hace un trato secreto con la agente Stahl para proteger a su mujer e hija. Entretanto, un confuso Opie busca tanto venganza como reconciliación.
70143844;2;12;La criba;47;La familia al completo se encierra mientras Jax y Clay se preparan para enfrentarse a la Liga. Weston descubre la verdad sobre los tratos de Zobelle.
70143844;2;13;Na Triobloidi;62;Mientras el club intenta echar de Charming a Zobelle y la Liga permanentemente, el regreso de ciertos rostros familiares plantea nuevos desafíos.
70143844;3;1;Entonces;52;Los Hijos siguen conmocionados tras el secuestro de Abel. Jax se ve particularmente afectado, y el dolor acentúa las dudas sobre su futuro en el club.
70143844;3;2;Engrasado;44;Jax y el club ayudan a un cazarrecompensas a cambio de obtener información sobre el paradero de Abel mientras Gemma se ocupa de ciertos problemas familiares.
70143844;3;3;La cuidadora;43;Falto de efectivo, el club aprovecha sus conexiones con el porno para divertir a los clientes de Lin, cosa que no sienta nada bien a cierto miembro.
70143844;3;4;Vuelta a casa;43;Mientras Jax y Clay se dirigen al norte en busca de Abel, Gemma intenta zanjar ciertos asuntos familiares que colean desde hace demasiado tiempo.
70143844;3;5;Vueltas y vueltas;46;Jax sella una improbable alianza para ayudar a su madre, a su hijo y al club. Entretanto, el club envía a Chucky de incógnito.
70143844;3;6;El empujón;43;Para proteger su territorio, los Hijos de la Anarquía deben ocuparse de un confidente en St. Thomas.
70143844;3;7;El círculo se amplía;44;Los Grim Bastards tienen un problema que podría poner en peligro los nuevos acuerdos comerciales del club.
70143844;3;8;El lodo del lago;59;Cuando el club principal visita a otra división, se producen fricciones entre ambos grupos.
70143844;3;9;Excursión;45;El club acepta un encargo de contrabando de armas para el Ejército Republicano Irlandés. Mientras, Margaret se ofrece a hacerle un favor a Tara.
70143844;3;10;En verdad;47;El Ejército Republicano Irlandés quiere pruebas de que uno de los suyos los ha traicionado, y los Hijos de la Anarquía pretenden dárselas.
70143844;3;11;La entrega;47;Mientras el club está en plena cacería humana, Jax se enfrenta a la decisión más difícil de su vida.
70143844;3;12;La boda de June;47;Uno de los miembros del club ha sido tomado como rehén, y Jax deberá elegir entre la venganza y lo que es mejor para Charming.
70143844;3;13;NS;62;El club trata de curar viejas heridas, pero se encontrará con la oposición de los rusos y la Oficina de Alcohol, Tabaco, Armas de Fuego y Explosivos.
70143844;4;1;Fuera;60;Recién salidos de prisión, Jax y los demás se reúnen con la familia, confrontan al nuevo alguacil de Charming y reevalúan sus alianzas empresariales.
70143844;4;2;Disparados;48;Los Hijos de la Anarquía se ven obligados a tomar una decisión que podría afectar al futuro del club.
70143844;4;3;Hormigas;43;El club da con un insólito enemigo cuando desaparece una pieza de su taller.
70143844;4;4;La venta;43;Mientras el club afronta una nueva iniciativa empresarial, Gemma da con una nuevo aliado en Charming.
70143844;4;5;Paquete;44;El sheriff presiona a Juice para sacarle más información, y el club recluta a un antiguo enemigo para detener las obras de Charming Heights.
70143844;4;6;Con x;43;La relación entre el club y el cártel peligra cuando un importante envío se ve comprometido.
70143844;4;7;Fruta para los cuervos;43;El club lidia con las consecuencias de una amenaza de muerte contra Tara, y Juice considera suicidarse.
70143844;4;8;Receta familiar;47;Los Hijos de la Anarquía dejan de lado una importante votación al verse obligados a lidiar con una peligrosa amenaza externa para el club.
70143844;4;9;El beso;47;En el club se enteran de que la banda de los Niners ha forjado una nueva alianza. Entretanto, Gemma y Unser encuentran el cuerpo de Piney.
70143844;4;10;Manos;43;Jax y Tara disfrutan de un atisbo de cómo sería la vida fuera del club, pero descubren lo difícil que resulta escapar de su realidad.
70143844;4;11;La llamada del deber;61;Un poderoso adversario pone en jaque los negocios del club con el cártel.
70143844;4;12;Quemado y purgado;47;El club negocia con los Irish Kings, unos traficantes de armas, para asegurar su futuro.
70143844;4;13;Ser, 1ª parte;47;Jax se enfrenta a un nuevo desafío que amenaza tanto a su familia como al club.
70143844;4;14;Ser, 2ª parte;43;Jax debe salvar enormes obstáculos mientras trata de poner fin al trato de tráfico de armas entre los Irish Kings y el cártel.
70143844;5;1;Soberano;61;Jax se hace cargo del club mientras una serie de eventos alteran el orden en Charming.
70143844;5;2;Autoridad conferida;49;Jax y el club se ven en aprietos cuando los pecados del pasado resurgen.
70143844;5;3;Uno debe morir;48;Una situación desesperada pone a prueba los vínculos familiares y del club.
70143844;5;4;Cosas robadas;46;Surgen complicaciones, y todos los Hijos se alían para enfrentarse a un nuevo adversario.
70143844;5;5;Pescando ballenas;46;Jax trata de orientar los esfuerzos del club hacia un nuevo negocio.
