Serie ID;#Season;#Episode;Episode title;Length (minutes);Synopsis
81022683;1;1;Episodio 1;60;La brillante compositora Yeimy planea su venganza contra aquellos que la enviaron a prisión. Viene a su memoria Charly, su amor de juventud y ahora un famoso cantante.
81022683;1;2;Episodio 2;55;Una joven Yeimy llora su pérdida. Soul and Bass consigue dinero con su primer concierto. Para demostrarle a su tío lo que vale, Charly acepta un encargo peligroso.
81022683;1;3;Episodio 3;46;Cuando Yeimy le reprocha a Charly lo que ha hecho, este se aprovecha de lo que ella siente por él y urde un plan para que su tío no la mate.
81022683;1;4;Episodio 4;46;Juancho se niega a creer que Yeimy es culpable, pero Charly intenta convencerlo de lo contrario. En prisión, Yeimy recibe amenazas y se entera de algo sorprendente.
81022683;1;5;Episodio 5;46;Tras visitar a Yeimy en Estados Unidos, su abuela recibe una desagradable sorpresa en casa. Años más tarde, Charly se pregunta por la familia de su hermano adoptado.
81022683;1;6;Episodio 6;46;Juancho llora la supuesta muerte de Yeimy. La expresidiaria llega a Puerto Rico y comienza el entrenamiento para hacerse pasar por la productora musical Tammy.
81022683;1;7;Episodio 7;46;Yeimy ha completado el entrenamiento y, por primera vez en 17 años, vuelve a Medellín, donde se encuentra por fin con Charly. Erik participa en una batalla musical.
81022683;1;8;Episodio 8;46;Juancho no sospecha que la mujer que tiene delante es Yeimy. Vanesa conoce a un cazatalentos de modelos. Charly intenta conquistar a una importante periodista.
81022683;1;9;Episodio 9;46;Yeimy asiste a la batalla musical para buscar nuevos talentos. Charly hace un concierto con la estrella del reguetón Sebastián Yatra y estrena la nueva canción de Yeimy.
81022683;1;10;Episodio 10;46;La agencia de modelos presiona a una pudorosa Vanesa. Yeimy le presenta a Charly un nuevo cantante y, más tarde, coloca un micrófono en la oficina.
81022683;1;11;Episodio 11;46;Vanesa les cuenta a sus padres que tiene un trabajo. Erik se va de casa tras una pelea con Charly. Juancho se ve obligado a trabajar para los estudios Excelsior.
81022683;1;12;Episodio 12;46;Erik busca información sobre sus padres biológicos. Yeimy y Juancho producen la primera canción de Cris. Gema sospecha que Charly se está viendo todavía con Zulma.
81022683;1;13;Episodio 13;46;Yeimy publica un vídeo que incrimina a Charly y Zulma, pero al tratar de hundir su carrera, también perjudica a su hija Vanesa.
81022683;1;14;Episodio 14;46;Erik recibe una oferta anónima que lo anima a grabar en secreto un álbum con Yeimy y Juancho. Charly se esfuerza por limpiar su imagen y mejorar sus relaciones.
81022683;1;15;Episodio 15;46;Cuando la DEA decide ir tras Manín, Charly se verá involucrado en la persecución. Yeimy intenta que Vanesa se sincere con ella y le da a Gema algunos consejos.
81022683;1;16;Episodio 16;46;Erik descubre la identidad de su madre biológica. Yeimy intenta que Gema confíe en ella. Charly vuelve a casa dispuesto a averiguar quién es el topo.
81022683;1;17;Episodio 17;46;Charly le pide a Axl que revise los vídeos de seguridad. Lucio sigue a Carrancho hasta una cabina de teléfonos. Cata sospecha cada vez más de Yeimy.
81022683;1;18;Episodio 18;46;Erik queda con la mediadora del informante en el parque. La relación de Ligia con Manín se hace insufrible. Juancho y Yeimy discuten por la actitud de ella con Charly.
81022683;1;19;Episodio 19;45;Erik descubre quién era el informante. Gema busca consuelo en otros brazos. Charly visita por sorpresa a Yeimy. Vanesa y Silvana van a una fiesta.
81022683;1;20;Episodio 20;45;El accidente tiene consecuencias devastadoras. Yeimy aprovecha la situación para llamar al padre de Silvana. Jack le dice a Yeimy lo que siente por ella.
81022683;1;21;Episodio 21;46;Tras un comentario de Yeimy, Juancho duda de su identidad. Vanesa se siente fatal cuando escucha las declaraciones del padre de Silvana en televisión.
81022683;1;22;Episodio 22;46;Gema registra la habitación de Vanesa para comprobar si les está mintiendo sobre las drogas. Juancho contacta con los músicos que aparecen con Yeimy en su página web.
81022683;1;23;Episodio 23;45;Juancho le dice a Yeimy que sospecha quién es. Vanesa discute con sus padres cuando estos le cuentan los planes que tienen para ella.
81022683;1;24;Episodio 24;45;Juancho discute con Yeimy sobre su venganza. Charly, que sospecha cada vez más de Yeimy y Juancho, hace que la sigan. La familia de Vanesa va a terapia.
81022683;1;25;Episodio 25;45;Charly visita la agencia de modelos. Yeimy le pide a la periodista Zulma que se encuentren en privado. Ruko, el camello, vuelve a ponerse en contacto con Vanesa.
81022683;1;26;Episodio 26;46;El último sencillo de Erik se estrena en la radio. Yeimy busca el modo de que Charly le pida a su tío un favor y así descubrir dónde se encuentra Manín.
81022683;1;27;Episodio 27;46;Cuando el sencillo de Erik supera al de Cris Vega, Charly quiere averiguar quién es Pez Koi y se pelea con Juancho. Gema se lleva una sorpresa cuando visita a Triana.
81022683;1;28;Episodio 28;46;Falcioni se da cuenta de que lo han seguido. Charly se desespera al no poder contactar con Yeimy. Erik celebra el éxito de su sencillo con sus amigos y familiares.
81022683;1;29;Episodio 29;46;Falcioni hace un trato con la DEA. Durante una rueda de prensa, Erik revela que él es Pez Koi. Tras hablarle a Yeimy de su aventura, Gema recibe un mensaje anónimo.
81022683;1;30;Episodio 30;46;Charly se pone furioso cuando descubre la verdadera identidad de Pez Koi, pero su madre interviene. Las sospechas de Cata aumentan. Yeimy y Zulma planean su próximo paso.
81022683;1;31;Episodio 31;46;Manín les ordena a sus matones que hagan lo que sea para que Charly le entregue el dinero. Vanesa se mete en problemas con la ley. Cata continúa investigando.
81022683;1;32;Episodio 32;46;Los hombres de Manín descubren algo sobre Yeimy. Gema y Charly se ven obligados a tomar una difícil decisión sobre Vanesa. Cata tiene una conversación con Juancho.
81022683;1;33;Episodio 33;45;Vanesa comienza la rehabilitación de mala gana. Cuando Yeimy da un paso más en la relación con Charly, Juancho se preocupa por ella. Los hombres de Manín van tras Ligia.
81022683;1;34;Episodio 34;46;Juancho le plantea a Yeimy qué está dispuesta a hacer para sacarle información a Charly. Manín ve una foto y sospecha de Charly. Vanesa se encuentra con alguien conocido.
81022683;1;35;Episodio 35;46;Cuando Erik llama a Manín al teléfono que Yeimy le dio, la DEA rastrea la llamada hasta la ubicación exacta y lanza una operación para atraparlo.
81022683;1;36;Episodio 36;45;En rehabilitación, Pao, la nueva amiga de Vanesa, le muestra una forma más saludable de escapar de sus problemas. Cata recibe una sorprendente noticia el día de su boda.
81022683;1;37;Episodio 37;45;Gema duda sobre su separación. Cata toma unas copas de más y da un emocionante discurso. Yeimy decide seguir ocultando su verdadera identidad.
81022683;1;38;Episodio 38;46;Gracias a Yeimy, Zulma tiene una noticia que publicar. Los ánimos se caldean entre Charly y Juancho cuando negocian las condiciones de un concierto. Erik visita a Vanesa.
81022683;1;39;Episodio 39;46;Yeimy, Gema y Charly deciden cambiar el recinto del concierto. Erik e Irma conectan cada vez más. Vanesa se escapa de rehabilitación.
81022683;1;40;Episodio 40;46;Vanesa pone en un compromiso a Yeimy cuando le pide un favor. Cata se sincera con su madre sobre Juancho. Charly se involucra de nuevo en los negocios de Manín.
81022683;1;41;Episodio 41;46;Cris Vega recibe una desagradable sorpresa. Erik y Charly ensayan antes del concierto. Yeimy ayuda a Gema a buscar un detective privado para investigar a su marido.
81022683;1;42;Episodio 42;45;Yeimy convence a Vanesa de que hable con su padre. El día del concierto, Irma ayuda a Erik a lidiar con los nervios. Charly recibe una sorpresa al llegar al recinto.
81022683;1;43;Episodio 43;45;Vanesa lleva a Ruko a visitar a su padre entre bambalinas. Axl descubre que Juancho deja entrar a menores al evento. Erik invita a una persona al escenario.
81022683;1;44;Episodio 44;46;Tras el sabotaje en el concierto, Erik se afana por recuperarse. Vanesa escucha a sus padres hablar sobre Ruko. El detective privado de Gema sigue a Charly.
81022683;1;45;Episodio 45;45;Cata decide estar más pendiente de Juancho. Las fotos del detective perturban a Yeimy. Vanesa descubre las drogas de Ruko. Zulma publica la entrevista con Cris Vega.
81022683;1;46;Episodio 46;46;Yeimy decide intervenir cuando escucha a Charly y Gema negociar pacíficamente los términos de su divorcio. Vanesa recibe una visita. Erik le pide a Irma que sea su novia.
81022683;1;47;Episodio 47;46;Juancho, que no puede reprimir sus propios sentimientos, le pregunta a Yeimy si sigue enamorada de Charly. Vanesa sale con los amigos y se topa con Ruko.
81022683;1;48;Episodio 48;45;Irma firma un contrato. El detective privado saca fotos de Charly haciendo sus negocios turbios. La madre de Cata le dice a su hija cómo llenar el vacío de su matrimonio.
81022683;1;49;Episodio 49;45;Cata decide seguir el consejo de su madre. Juancho se queda atónito cuando Erik le cuenta sobre su madre biológica. Charly chantajea a Gema para conseguir lo que quiere.
81022683;1;50;Episodio 50;46;Juancho ayuda a Yeimy a procesar la noticia. Charly investiga el coche que lo sigue. Gema sale con una persona e intenta más tarde reunir pruebas contra Charly.
81022683;1;51;Episodio 51;46;Juancho le pide a Erik que no le pregunte a Charly sobre Yeimy Montoya. Yeimy pide una prueba de ADN. Gema reúne lo que necesita para enfrentarse a Charly.
81022683;1;52;Episodio 52;46;Vanesa tiene una charla con Pite. Lucio atrapa al detective privado. Cata descubre que Juancho le miente una vez más. Yeimy da un giro a su relación con Charly.
81022683;1;53;Episodio 53;46;Charly recibe malas noticias de don Edgar. Yeimy ayuda a Vanesa con Ruko. Cuando Gema le muestra a Charly las pruebas que lo incriminan, este decide que debe detenerla.
81022683;1;54;Episodio 54;46;Charly le pide a Lucio un favor. Yeimy atrapa a Ruko con ayuda de la DEA. Cata presiona a Juancho para que contrate a más artistas, incluido a Cris Vega.
81022683;1;55;Episodio 55;45;Tras saber que Gema va a trabajar hasta tarde en el estudio, Charly llama a Lucio. Cuando Vanesa hace cambiar a Gema de opinión sobre Charly, Yeimy juega su última baza.
81022683;1;56;Episodio 56;45;Yeimy le pide a Zulma que grabe su testimonio en vídeo. Pite, siguiendo su propia experiencia, aconseja a Vanesa. Juancho va tras Charly para ver con quién se encuentra.
81022683;1;57;Episodio 57;45;Erik duda de la versión de Charly. El nuevo novio de Gema irrumpe en un servicio religioso. Yeimy le pide a Juancho que recoja los resultados de la prueba de ADN.
81022683;1;58;Episodio 58;46;Axl revisa las imágenes de seguridad de Excelsior. Zulma publica el vídeo de Yeimy contando su versión de la historia. Cris Vega hace una audición para Juancho.
81022683;1;59;Episodio 59;46;Las dudas sobre su matrimonio atormentan a Juancho y Cata pasa más tiempo con Cris. La policía recibe los resultados del análisis. Erik y Yeimy colaboran en una canción.
81022683;1;60;Episodio 60;46;Con las pruebas de ADN en su contra, Charly se afana por ocultar las pistas. Pite intenta animar a Vanesa. Juancho descubre que Cata desea quedarse embarazada.
81022683;1;61;Episodio 61;46;Erik sigue a Irma a casa y descubre algo que lo dejará sorprendido. Pite le hace una confesión a Vanesa. Tomando unas copas, Cris consigue que Cata se sincere con él.
81022683;1;62;Episodio 62;45;La policía va tras Yeimy, quien tendrá que decidir si huye o se entrega. Erik descubre cómo averiguaron dónde se ocultaba Yeimy.
81022683;1;63;Episodio 63;46;Juancho le descubre a la policía la verdadera identidad de Yeimy. Cata le da una noticia sorprendente a Juancho. Charly logra que lo dejen hablar con Yeimy.
81022683;1;64;Episodio 64;46;Axl le muestra a Charly una nueva canción que ha escrito. Tras saber la noticia de Juancho, Yeimy recibe una visita sorpresa. Charly enseña a Irma a seducir al público.
81022683;1;65;Episodio 65;46;Vanesa se enfrenta a Yeimy. El informe de balística está disponible. Yeimy recibe un aviso de que la van a atacar. Zulma lanza una campaña para liberar a Yeimy.
81022683;1;66;Episodio 66;46;Vanesa tiene la sensación de que su padre le oculta algo y registra su dormitorio. La policía consigue una orden para arrestar al contable de Charly.
81022683;1;67;Episodio 67;46;Tras la visita de Jack y Juancho, Yeimy toma una importante decisión. Axl no lleva bien las diferencias creativas con Charly. Irma se harta de su padre.
81022683;1;68;Episodio 68;45;Yeimy decide revelar su verdadera identidad a Charly. Lucio le entrega a su novia un objeto para que lo guarde en un sitio seguro. Vanesa le presenta a su padre a Pite.
81022683;1;69;Episodio 69;46;Yeimy le dice a Erik quién es su madre biológica y responde a sus preguntas. La policía le pisa los talones a Lucio. Ligia descubre la verdad sobre los orígenes de Erik.
81022683;1;70;Episodio 70;46;Erik le cuenta quién es su padre a Charly. Cata va a la casa de Yeimy por sorpresa. La policía llama a un número desconocido grabado en el teléfono de Lucio.
81022683;1;71;Episodio 71;45;"Yeimy acepta trabajar para Surround con una condición; más tarde, desvela un secreto en Internet. Cuando Mora se pone ambicioso, la abogada de Charly urde un plan."
81022683;1;72;Episodio 72;45;El destino hace que Cata esté a la hora y en el lugar equivocados. Axl sospecha que Charly le va a robar su canción. La novia de Lucio descubre lo que hay en el teléfono.
81022683;1;73;Episodio 73;46;Juancho toma una decisión sobre Cata. La novia de Lucio le hace una visita a Charly. Irma descubre a quién hirió su padre. Yeimy organiza un encuentro con Axl.
81022683;1;74;Episodio 74;46;Yeimy se reúne con Mora gracias a la policía. Charly queda con la novia de Lucio para entregarle el dinero. Irma le cuenta a su padre lo que descubrió sobre la víctima.
81022683;1;75;Episodio 75;45;Axl hace una audición para Yeimy. Ligia visita al padre de Irma. Erik y Cris comienzan su competición. Irma trata de acallar los rumores que la relacionan con Charly.
81022683;1;76;Episodio 76;46;Rosalía trata de enamorar a Juancho. Mora solicita hablar con el inspector Contreras y Yeimy. El hombre que desbloqueó el teléfono para Marlene acude a la policía.
81022683;1;77;Episodio 77;46;Rosalía intenta mantener a Juancho lejos de Yeimy. El padre de Irma, José, visita a Ligia. Yeimy le pide ayuda a Axl para demostrar la culpabilidad de Charly.
81022683;1;78;Episodio 78;46;Yeimy organiza un encuentro con el amigo de Marlene que desbloqueó el teléfono. Una fan de Erik le hace una pregunta delicada. Juancho decide conquistar a Yeimy.
81022683;1;79;Episodio 79;45;José hace una entrevista de trabajo. Cuando Vanesa escucha la grabación, Yeimy le confiesa sus más terribles secretos. Juancho descubre que Rosalía intentó comprar votos.
81022683;1;80;Episodio 80;46;Vanesa duda sobre si debe entregar a la policía lo que encontró en el armario. Yeimy y Jack mantienen una conversación muy tensa. Cata tiene una noticia para Juancho.
81022683;1;81;Episodio 81;46;Axl cambia de opinión y Charly se enfrenta a él. Durante el concierto, Erik invita a su padre a que suba al escenario. Los análisis de la grabación están disponibles.
81022683;1;82;Episodio 82;45;Vanesa recibe una llamada de su padre y le cuenta un secreto. Charly toma una decisión arriesgada. Han pasado dos años y el futuro de todos se ha ido desdibujando.
80192098;1;1;Episode 1;80;El Profesor recluta a una joven experta en atracos y a otros siete delincuentes para llevar a cabo un gran asalto a la Fábrica Nacional de Moneda y Timbre.
80192098;1;2;Episodio 2;67;Raquel, la negociadora de rehenes, establece un primer contacto con el Profesor. La policía consigue una imagen de la cara de uno de los ladrones.
80192098;1;3;Episode 3;63;Raquel sufre una crisis con su ex. Los rehenes se asustan al oír disparos. Los ladrones discuten entre sí.
80192098;1;4;Episode 4;64;Los atracadores permiten la entrada a un equipo médico y un policía se infiltra entre ellos. ¿Podrá el Profesor mantenerse un paso por delante de Raquel?
80192098;1;5;Episode 5;69;A Río le inquietan las noticias que ve en la televisión. Cierto avance en la investigación pone al Profesor en peligro de ser descubierto.
80192098;1;6;Episode 6;74;Cuando la prensa revela su identidad, Berlín quiere vengarse. Tokio pilla a Alison charlando con Río y se encara con ella.
80192098;1;7;Episodio 7;67;Raquel entra en la Fábrica de Moneda y Timbre para asegurarse de que todos los rehenes se encuentran sanos y salvos. Nairobi aconseja a Alison.
80192098;1;8;Episodio 8;68;Arturo urde un plan de fuga para un grupo de rehenes. Ángel y Raquel no se fían el uno del otro. Mónica mueve ficha con Denver.
80192098;1;9;Episodio 9;72;El Profesor revela quién le dio la idea para el plan. En la Fábrica de Moneda y Timbre, los atracadores les hacen una oferta a los rehenes: dinero o libertad.
80192098;2;1;Episodio 1;63;El Profesor pierde el control cuando la policía científica rastrea la casa de campo de Toledo en busca de restos de ADN. En la Fábrica, los nervios están a flor de piel.
80192098;2;2;Episodio 2;62;La policía interroga a la primera atracadora que cae en sus manos. Hecho una furia por las últimas decisiones de Berlín, Río le planta cara.
80192098;2;3;Episodio 3;64;Los atracadores, conscientes de que su plan no funciona, deciden ganarse el favor de la opinión pública. Raquel le tiende una trampa al Profesor para capturarlo.
80192098;2;4;Episodio 4;71;Arturo se enfrenta a un duro castigo por intentar montar otro plan de fuga. Tras confesarle la verdad a Denver, Moscú pierde su confianza.
80192098;2;5;Episodio 5;64;Cuando la relación de Raquel con el Profesor sale a la luz y la apartan del caso, la inspectora decide cazar al cabecilla de la banda por su cuenta.
80192098;2;6;Episodio 6;69;La policía ha entrado en la Fábrica y Berlín se pone al frente de los atracadores para intentar escapar con los 984 millones de euros y, a ser posible, vivos.
80221207;1;1;Los Cangris;51;En el año 2000, a Nicky Jam y Daddy Yankee, dos artistas con futuro, se les presenta una gran oportunidad mientras que las acciones de su amigo Tito los pone en peligro.
80221207;1;2;Escape a Nueva Yol;44;Los Cangris vuelan a Nueva York huyendo de Cuti, que les sigue sin que ellos sepan por qué. Aleysha hace una impactante revelación. Nicky aumenta su consumo de droga.
80221207;1;3;Con el micrófono y la forty;44;Los Cangris se preparan para el concierto de Coyote, y Cuti amenaza a los amigos y familia de Nicky, que recuerda las dificultades que vivió su madre durante su infancia.
80221207;1;4;En la cama;47;Yankee ayuda a pagar la fianza de Nicky, que visita a Aleysha cuando está de gira en Florida. Más tarde, hace una parada en Massachusetts para buscar a su madre.
80221207;1;5;El infiltrado;46;Nicky va a prisión, donde su adicción le acarrea problemas, y recibe una visita sorpresa. Las deudas de Isabel ponen a José en apuros.
80221207;1;6;Vida escante;41;La rivalidad musical con Daddy Yankee va en aumento y Nicky siente celos del éxito de su colega. José traslada su familia a la casa de su hermano en San Juan.
80221207;1;7;El origen;45;La adicción de Nicky a los opiáceos se agrava hasta tal punto que afecta a su carrera y su nueva novia se engancha también. José se enfrenta a su pasado delictivo.
80221207;1;8;El futuro es paisa;47;Tras viajar a Colombia para un concierto, Nicky recupera su autoestima y conoce a otra mujer. En 1994, un Nicky adolescente es descubierto en un supermercado.
80221207;1;9;Medellín;44;Nicky se muda a Medellín, escribe nuevas canciones e inicia una relación, pero sigue siendo un juerguista empedernido. Un ambicioso Juan Diego intenta demostrar su valía.
80221207;1;10;Cold turkey;46;Mientras ayuda a Nicky a desintoxicarse, José entiende la gravedad de la adicción de su hijo. El cantante vuelve a trabajar, pero no se libra de la tentación.
80221207;1;11;Ave Fénix;44;Juan Diego usa sus dotes comerciales y tácticas engañosas para resucitar la carrera musical de Nicky. Mientras tanto, el cantante está preocupado por su madre.
80221207;1;12;Isabel;43;Nicky, de gira en República Dominicana, vuelve a ver a su madre, que viaja con él a Medellín para desintoxicarse y le pide que reflexione sobre su vida amorosa.
80221207;1;13;Dímelo Papi, llegamos al Choli;41;Nicky visita Lawrence cuando un amigo de la infancia sufre una tragedia. El cantante disfruta del éxito internacional, pero el regreso a Puerto Rico le causa ansiedad.
80036140;1;1;Episodio 1;42;Cuando su padre se gasta el dinero de la universidad, Brenda se ve obligada a trabajar para pagarse los estudios. Braulio asesina al prometido de su hija Guadalupe.
80036140;1;2;Episodio 2;44;Gregorio le muestra a Braulio su invento para ocultar cocaína en los zapatos. Braulio le da a Lucrecia los papeles del divorcio. Brenda incendia el laboratorio de drogas.
80036140;1;3;Episodio 3;44;Brenda interroga a Nicanor sobre el fuego causado por la cocaína, pero él lo niega. El padre de Brenda es arrestado por tráfico de drogas.
80036140;1;4;Episodio 4;43;Norman rapta a Lucrecia para asustarla, pero esta le ofrece un trabajo que le interesa. Brenda hace negocios con Braulio para sacar a su padre de la cárcel.
80036140;1;5;Episodio 5;43;Culpan a Brenda del secuestro de Lucrecia. Norman soborna a la persona a cargo de los vídeos de los cajeros para destruir las pruebas. La DEA arresta al capi.
80036140;1;6;Episodio 6;44;Braulio quiere presumir de Brenda y Olivia en la cabalgata. Israel reaparece para hostigar a Renata. El avión del capi lleno de cocaína desaparece.
80036140;1;7;Episodio 7;44;Duber y Erick le juran a Gregorio que Giovanni no tiene conexiones con la mafia. Olivia le confiesa a Brenda que estuvo muy a gusto con Braulio.
80036140;1;8;Episodio 8;42;Olivia se escapa de la casa para cenar con Braulio. Norman recibe una misteriosa nota en la que se hace referencia a su delito.
80036140;1;9;Episodio 9;45;Olivia le cuenta a Brenda que quiere ir a Cartagena con Braulio y sus amigos. Pamela hace planes para entregar a Braulio a la DEA.
80036140;1;10;Episodio 10;44;Arrestan a Giovanni y Violeta cuando están con Duber y Renata. Norman llega a Cartagena, pero se lleva una sorpresa al ver a su esposa allí también.
80036140;1;11;Episodio 11;43;Braulio se despierta y se queda atónito al ver a Olivia completamente desnuda tumbada a su lado. Giovanni comete un grave error con Duber.
80036140;1;12;Episodio 12;43;Leonel piensa castigar duramente a Renata. Violeta le pide a Giovanni que deje de trabajar con Norman. Braulio agasaja a Olivia con regalos y dinero.
80036140;1;13;Episodio 13;43;Braulio descubre quién intentó asesinar a Norman. Gregorio le ruega a Norman que deje ir a Giovanni, pero Norman tiene otros planes.
80036140;1;14;Episodio 14;44;Braulio obliga a Lucrecia y Norman a resolver sus problemas. El padre de Olivia hace que sigan a su hija hasta la casa de Braulio. Brenda y Nicolás comienzan a salir.
80036140;1;15;Episodio 15;43;Pamela le confiesa a Violeta que quiere ver muerto a Erick. Leonel está encantado de trabajar con Norman, sin saber en el lío que se está metiendo.
80036140;1;16;Episodio 16;44;Braulio quiere que Brenda lo acompañe a Miami y le ayude a encontrar a Olivia. Pamela se hace cada vez más amiga de Asdrúbal para protegerse de Erick.
80036140;1;17;Episodio 17;44;Erick se pone celoso cuando descubre que Pamela está saliendo con Asdrúbal. Braulio hace una fiesta cuando aprueban su visado para EE UU. Violeta se enfrenta a Giovanni.
80036140;1;18;Episodio 18;44;Braulio nombra a Leonel como el contable oficial de la organización. Entregan los 100 primeros kilos del producto. Erick vuelve a amenazar a Pamela.
80036140;1;19;Episodio 19;44;Brenda les cuenta a sus padres que tiene un trabajo de canguro en EE UU, pero la verdad es que viaja a Miami con Braulio. Publican las fotos de Giovanni con Violeta.
80036140;1;20;Episodio 20;42;Cuando se entera de que Braulio está en EE UU, la DEA pone en marcha su plan interrogando al capi. Brenda se cae por la borda. Nicolás sale de un bar con Guadalupe.
80036140;1;21;Episodio 21;43;Olivia espera en Miami a que llegue Brenda. Belén le reprocha a Giovanni que sea un narcotraficante. Braulio le hace una pregunta importante a Olivia.
80036140;1;22;Episodio 22;44;Brenda y sus amigas utilizan el escondite de Braulio para hacer una fiesta. Giovanni promete trabajar el doble con el taxi para ganar dinero.
80036140;1;23;Episodio 23;45;El abogado de Braulio anuncia que han levantado la orden de arresto, pero que un topo le está pasando información a la DEA. Braulio sospecha de Brenda.
80036140;1;24;Episodio 24;45;Braulio y Brenda intiman. Renata le dice a su marido que se ha enterado de su aventura con Melisa, la nueva socia del burdel.
80036140;1;25;Episodio 25;43;Leonel interroga a Elmer para ver si Renata quiso asesinar a Melisa. Braulio empieza a sospechar de Olivia. Nicanor, el rival de Braulio, le ofrece un trabajo a Pamela.
80036140;1;26;Episodio 26;43;Brenda le pide a Nicolás que cuide de Guadalupe. Renata hará lo que sea para huir de la furia asesina de Leonel, incluso robarle el dinero.
80036140;1;27;Episodio 27;43;El romance de Brenda con Braulio continúa. Karina se enfrenta a Noelia, la mujer de Norman, a causa de Violeta. Braulio interviene para salvarle la vida a Renata.
